<?xml version="1.0" ?>
<mdv xmlns:xsi="http://www.w3.org/2001/XMLSchema-instance" version="1.0" xsi:schemaLocation="http://www.ral.ucar.edu/xml/schemas/mdv.1.0.xsd http://www.ral.ucar.edu/xml/schemas/mdv.1.0.xsd">
  <buf-file-name>000000.mdv.buf</buf-file-name>
  <master-header>
    <time-valid>2008-01-04T00:00:00</time-valid>
    <time-gen>2008-01-04T00:00:06</time-gen>
    <forecast-lead-secs>0</forecast-lead-secs>
    <time-written>2008-01-24T17:23:36</time-written>
    <time-user>1970-01-01T00:00:00</time-user>
    <time-begin>2008-01-03T23:50:36</time-begin>
    <time-end>2008-01-03T23:54:59</time-end>
    <time-expire>2008-01-04T00:04:23</time-expire>
    <data-set-name>SAWS 3D Mosaic - include MZ</data-set-name>
    <data-set-info>Data merged from following files:
  /hd1/data/mdv/radar/faeo/20080103/235809.mdv
  /hd1/data/mdv/radar/fair/20080103/235653.mdv
  /hd1/data/mdv/radar/fabl/20080103/235625.mdv
  /hd1/data/mdv/radar/fadn/20080103/235520.mdv
  /hd1/data/mdv/radar/fady/20080103/235658.mdv
  /hd1/data/mdv/radar/fael/20080103/235459.mdv
  /hd1/data/mdv/radar/fape/20080103/235753.mdv
  /hd1/data/mdv/radar/fact/20080103/235723.mdv
</data-set-info>
    <data-set-source>Merged data created by MdvMerge2.</data-set-source>
    <sensor-lon>0.00000000</sensor-lon>
    <sensor-lat>0.00000000</sensor-lat>
    <sensor-alt>0.00000000</sensor-alt>
    <data-dimension>3</data-dimension>
    <data-collection-type>measured</data-collection-type>
    <vlevel-type>height-msl-km</vlevel-type>
    <native-vlevel-type>elevation-angles</native-vlevel-type>
    <user-data>0</user-data>
    <user-int-0>0</user-int-0>
    <user-int-1>0</user-int-1>
    <user-int-2>0</user-int-2>
    <user-int-3>0</user-int-3>
    <user-int-4>0</user-int-4>
    <user-int-5>0</user-int-5>
    <user-int-6>0</user-int-6>
    <user-int-7>0</user-int-7>
    <user-float-0>0</user-float-0>
    <user-float-1>0</user-float-1>
    <user-float-2>0</user-float-2>
    <user-float-3>0</user-float-3>
    <user-float-4>0</user-float-4>
    <user-float-5>0</user-float-5>
    <field-grids-differ>false</field-grids-differ>
    <n-fields>1</n-fields>
    <n-chunks>0</n-chunks>
  </master-header>
  <field>
    <field-name>DBZ</field-name>
    <field-name-long>DBZ</field-name-long>
    <field-units>dBZ</field-units>
    <field-transform>dBZ</field-transform>
    <encoding-type>int16</encoding-type>
    <byte-width>2</byte-width>
    <field-data-scale>0.00133588</field-data-scale>
    <field-data-bias>-31.5267</field-data-bias>
    <compression-type>none</compression-type>
    <transform-type>none</transform-type>
    <scaling-type>dynamic</scaling-type>
    <missing-data-value>0.00000000</missing-data-value>
    <bad-data-value>0.00000000</bad-data-value>
    <min-value>-31.50000000</min-value>
    <max-value>56.00000000</max-value>
    <data-dimension>3</data-dimension>
    <dz-constant>true</dz-constant>
    <projection>
      <proj-type>latlon</proj-type>
      <origin-lat>0.00000000</origin-lat>
      <origin-lon>0.00000000</origin-lon>
    </projection>
    <xy-grid>
      <nx>1380</nx>
      <ny>1200</ny>
      <minx>15.00000000</minx>
      <miny>-37.00000000</miny>
      <dx>0.01666666</dx>
      <dy>0.01666666</dy>
    </xy-grid>
    <n-vlevels>17</n-vlevels>
    <vlevel-type>height-msl-km</vlevel-type>
    <native-vlevel-type>elevation-angles</native-vlevel-type>
    <vlevels>
      <level>1</level>
      <level>2</level>
      <level>3</level>
      <level>4</level>
      <level>5</level>
      <level>6</level>
      <level>7</level>
      <level>8</level>
      <level>9</level>
      <level>10</level>
      <level>11</level>
      <level>12</level>
      <level>13</level>
      <level>14</level>
      <level>15</level>
      <level>16</level>
      <level>17</level>
    </vlevels>
    <vert-reference>0</vert-reference>
    <data-offset-bytes>0</data-offset-bytes>
    <data-length-bytes>56304000</data-length-bytes>
    <user-int-0>0</user-int-0>
    <user-int-1>0</user-int-1>
    <user-int-2>0</user-int-2>
    <user-int-3>0</user-int-3>
    <user-int-4>0</user-int-4>
    <user-int-5>0</user-int-5>
    <user-int-6>0</user-int-6>
    <user-int-7>0</user-int-7>
    <user-int-8>0</user-int-8>
    <user-int-9>0</user-int-9>
    <user-float-0>0</user-float-0>
    <user-float-1>0</user-float-1>
    <user-float-2>0</user-float-2>
    <user-float-3>0</user-float-3>
  <user-time-1>1970-01-01T00:00:00</user-time-1>
  <user-time-2>1970-01-01T00:00:00</user-time-2>
  <user-time-3>1970-01-01T00:00:00</user-time-3>
  <user-time-4>1970-01-01T00:00:00</user-time-4>
    <grib-code>0</grib-code>
  </field>
</mdv>
